{
  "prediction_id": "11111111-1111-1111-1111-111111111111",
  "prediction_run_id": "22222222-2222-2222-2222-222222222222",
  "match_id": "match-0001",
  "prediction_horizon": "PRE_MATCH",
  "evaluation_context": "PRODUCTION",
  "publication_state": "PUBLISHED",
  "home_probability": 0.55,
  "draw_probability": 0.25,
  "away_probability": 0.20,
  "created_at": "2026-08-10T12:00:00Z"
}
